{
  "schema": "challenge-escrow.release-manifest/v1",
  "manifestHash": "0xbd3d33f86a0ddd1bdda1af3104bb48eaabe2f82a9d3ff53ed6ca6fb0eedb8b80",
  "release": {
    "contract": "ChallengeEscrow",
    "protocolVersion": "challenge-escrow-protocol/v1",
    "eventProtocolId": "challenge-escrow-event/v1",
    "challengeSchemaId": "challenge-escrow.spec/v1",
    "evidenceSchemaId": "challenge-escrow.evidence/v1",
    "conditionLanguageId": "challenge-escrow.condition-language/v1",
    "valueMode": "TESTNET_NO_VALUE"
  },
  "compiler": {
    "version": "0.8.36+commit.8a079791",
    "evmVersion": "cancun",
    "optimizer": {
      "enabled": true,
      "runs": "1"
    },
    "metadataBytecodeHash": "none"
  },
  "runtime": {
    "artifactPath": "contracts/out/ChallengeEscrow.sol/ChallengeEscrow.json",
    "bytes": "23270",
    "sha256": "sha256:91fded4143df975c57a3b83fc36decef8e6a829cd82b2393190515ef0774a8fa",
    "keccak256": "0x30d6efa6dfb6c41174980ad79a10bf05c1c85e28951e6e250e6783dd13c7b6b1",
    "normalizedKeccak256": "0x30d6efa6dfb6c41174980ad79a10bf05c1c85e28951e6e250e6783dd13c7b6b1",
    "immutableReferences": [
      {
        "start": "589",
        "bytes": "32"
      },
      {
        "start": "958",
        "bytes": "32"
      },
      {
        "start": "1047",
        "bytes": "32"
      },
      {
        "start": "1330",
        "bytes": "32"
      },
      {
        "start": "1562",
        "bytes": "32"
      },
      {
        "start": "1740",
        "bytes": "32"
      },
      {
        "start": "1805",
        "bytes": "32"
      },
      {
        "start": "2224",
        "bytes": "32"
      },
      {
        "start": "3099",
        "bytes": "32"
      },
      {
        "start": "8341",
        "bytes": "32"
      },
      {
        "start": "9538",
        "bytes": "32"
      },
      {
        "start": "10339",
        "bytes": "32"
      },
      {
        "start": "13366",
        "bytes": "32"
      },
      {
        "start": "13474",
        "bytes": "32"
      },
      {
        "start": "16163",
        "bytes": "32"
      },
      {
        "start": "16299",
        "bytes": "32"
      },
      {
        "start": "16414",
        "bytes": "32"
      },
      {
        "start": "17097",
        "bytes": "32"
      },
      {
        "start": "18012",
        "bytes": "32"
      },
      {
        "start": "18072",
        "bytes": "32"
      },
      {
        "start": "18132",
        "bytes": "32"
      },
      {
        "start": "18493",
        "bytes": "32"
      },
      {
        "start": "18553",
        "bytes": "32"
      },
      {
        "start": "18613",
        "bytes": "32"
      }
    ],
    "immutableGroups": [
      {
        "name": "arbiter",
        "compilerId": "1380",
        "references": [
          {
            "start": "1740",
            "bytes": "32"
          },
          {
            "start": "1805",
            "bytes": "32"
          },
          {
            "start": "18132",
            "bytes": "32"
          },
          {
            "start": "18613",
            "bytes": "32"
          }
        ]
      },
      {
        "name": "canonicalToken",
        "compilerId": "1374",
        "references": [
          {
            "start": "1562",
            "bytes": "32"
          },
          {
            "start": "3099",
            "bytes": "32"
          },
          {
            "start": "8341",
            "bytes": "32"
          },
          {
            "start": "13366",
            "bytes": "32"
          },
          {
            "start": "16163",
            "bytes": "32"
          },
          {
            "start": "16299",
            "bytes": "32"
          },
          {
            "start": "18012",
            "bytes": "32"
          },
          {
            "start": "18493",
            "bytes": "32"
          }
        ]
      },
      {
        "name": "pauser",
        "compilerId": "808",
        "references": [
          {
            "start": "1330",
            "bytes": "32"
          },
          {
            "start": "2224",
            "bytes": "32"
          },
          {
            "start": "16414",
            "bytes": "32"
          },
          {
            "start": "17097",
            "bytes": "32"
          }
        ]
      },
      {
        "name": "releaseId",
        "compilerId": "1382",
        "references": [
          {
            "start": "1047",
            "bytes": "32"
          }
        ]
      },
      {
        "name": "resolver",
        "compilerId": "1378",
        "references": [
          {
            "start": "589",
            "bytes": "32"
          },
          {
            "start": "9538",
            "bytes": "32"
          },
          {
            "start": "10339",
            "bytes": "32"
          },
          {
            "start": "18072",
            "bytes": "32"
          },
          {
            "start": "18553",
            "bytes": "32"
          }
        ]
      },
      {
        "name": "tokenDecimals",
        "compilerId": "1376",
        "references": [
          {
            "start": "958",
            "bytes": "32"
          },
          {
            "start": "13474",
            "bytes": "32"
          }
        ]
      }
    ],
    "abiEntries": "140",
    "abiSha256": "sha256:b55f791bfde441d789e7b16b4b64e36c576fe97646c5a39378752e461ef5e72e"
  },
  "productionSources": [
    {
      "path": "contracts/src/ChallengeEscrow.sol",
      "bytes": "2430",
      "sha256": "sha256:bdb0f993a48cc882aaa8f10e0ccb5d05ab768cbd486e7fdac912ab3f1602c73f"
    },
    {
      "path": "contracts/src/ChallengeEscrowKernel.sol",
      "bytes": "45968",
      "sha256": "sha256:78c4c34d5a46ffe71e5c657e49be7f79a0dec7ca2f2317555f85622a096f16b2"
    },
    {
      "path": "contracts/src/ChallengeTypes.sol",
      "bytes": "3878",
      "sha256": "sha256:dff2a6607109119467d57cec89a7dba204685c813bc3468c57dc4c571b907ceb"
    },
    {
      "path": "contracts/src/libraries/AcceptancePermitHash.sol",
      "bytes": "1697",
      "sha256": "sha256:e067e2139618fb5c7919dd0959eda88e0877d6550280736672f9de4887ab2e7f"
    },
    {
      "path": "contracts/src/libraries/ChallengeCommitment.sol",
      "bytes": "1928",
      "sha256": "sha256:8942b1ab53a6237ee2841db5b811023da672edf460c8c1f0c7789c0fb6da7a49"
    },
    {
      "path": "contracts/src/libraries/ChallengeIds.sol",
      "bytes": "1073",
      "sha256": "sha256:de1c90e08e1bcd97d4a0fb971ae67dace3a50286e30ebe2d15e2fc8e2442979b"
    },
    {
      "path": "contracts/src/libraries/ExactTokenDelta.sol",
      "bytes": "4010",
      "sha256": "sha256:7cd75734ec899ad44bfe7dd9aa0b38227131203b93397cda4dd9db2a2abf8090"
    }
  ],
  "publicArtifacts": [
    {
      "path": ".github/CODEOWNERS",
      "bytes": "11",
      "sha256": "sha256:f4c6a76037f26798275960ae785667b962aef3ff0091acf4ccdef10bfbbdac48"
    },
    {
      "path": ".github/ISSUE_TEMPLATE/config.yml",
      "bytes": "449",
      "sha256": "sha256:930a581dbeb38b86f49f698fcafa25930fc18a10248cc4bcbf680dfa8dcfd10a"
    },
    {
      "path": ".github/ISSUE_TEMPLATE/reproducible-finding.yml",
      "bytes": "1203",
      "sha256": "sha256:d9034e3dc70b6fe48fec5d0704d19577dc03b7007fe7c555e7b7875078d65fab"
    },
    {
      "path": ".github/ISSUE_TEMPLATE/research-question.yml",
      "bytes": "988",
      "sha256": "sha256:2e633ca5caa4b1a333adea1edd672d083d9e93911009beacc5c532d297170dd6"
    },
    {
      "path": ".github/dependabot.yml",
      "bytes": "382",
      "sha256": "sha256:aa22769ff3f12587359b0cb735eb6e6ac9259f28e79b78d6539f6ab6166c49b7"
    },
    {
      "path": ".github/workflows/verify.yml",
      "bytes": "1755",
      "sha256": "sha256:2b6ec48737140448c991536d4e7831bc30fb36e60a4ecac84e5856990fa29e20"
    },
    {
      "path": ".gitignore",
      "bytes": "357",
      "sha256": "sha256:70b8354699f0731904ef6d2c8eec98992bb157dc74a663b05095c7f5bc0c4007"
    },
    {
      "path": ".npmrc",
      "bytes": "36",
      "sha256": "sha256:b6cd21f5dbc7be423e7b31e3014be09c8e2fe578a817a0eb2d03952706a2c8c6"
    },
    {
      "path": "CITATION.cff",
      "bytes": "544",
      "sha256": "sha256:733563738397c96930c4297359057c3e7f3e51f3dd44883bb965ddd40b8a9370"
    },
    {
      "path": "CONTRIBUTING.md",
      "bytes": "1630",
      "sha256": "sha256:43269e5b4c9ec8ec48eabbbb8bc459e8a03d37834a5c94dbb3fb08af3db27e0d"
    },
    {
      "path": "LICENSE",
      "bytes": "1069",
      "sha256": "sha256:a77158e55a7fbc02718b09e12a06a0ab8e79a39164ce5a81403fc0fecbd2b4d7"
    },
    {
      "path": "NOTICE.md",
      "bytes": "461",
      "sha256": "sha256:d8bab102088a9ecf310a977c411bb3d53346f441fb23a10eb616fc571e6838e2"
    },
    {
      "path": "README.md",
      "bytes": "9305",
      "sha256": "sha256:5abdef98e6b4a4291503c1285edbe4064b25fef0d1018fc74c336d535eeaa785"
    },
    {
      "path": "SECURITY.md",
      "bytes": "1872",
      "sha256": "sha256:447c6a35881ccb59231f3e96f30b4c496ad73ccb3904fb82b86d1b680eaa091f"
    },
    {
      "path": "contracts/foundry.toml",
      "bytes": "604",
      "sha256": "sha256:ff34dbee9255e0f93d32d5d3e4fdaaf2dc60cc673fb1a7ef34cb55fb925811cf"
    },
    {
      "path": "contracts/package.json",
      "bytes": "178",
      "sha256": "sha256:6ae3ee3b44637bc7866159a23f00c6a92c64e2137b161be6bb00a78f117acf70"
    },
    {
      "path": "contracts/test/ChallengeEscrow.t.sol",
      "bytes": "52046",
      "sha256": "sha256:768e035409f94a9ade00d37a1abd779b1fcb708cd66903612f9e790a9d8e216e"
    },
    {
      "path": "contracts/test/ChallengeEscrowInvariants.t.sol",
      "bytes": "2381",
      "sha256": "sha256:d689a2cb77ed2bd5695bffada4bf610b879795eb58fb2ee5f1a1668dbc1d4f09"
    },
    {
      "path": "contracts/test/ChallengeEscrowSecurity.t.sol",
      "bytes": "23122",
      "sha256": "sha256:f28294df28380c5ec6ac4e0d65409b8c930994bc9e1fa5dd81d39614aa15f37e"
    },
    {